Mural Panel,Chapter,Mural Scene,Sun of Faith - Tibetan (བོད་ཡིག།),Sun of Faith - English,Inscription - Tibetan (བོད་ཡིག།) ,Inscription - English,Manual - Tibetan (བོད་ཡིག།),Manual - English,Main Canonical Source (sde dge bka' 'gyur),Secondary/Tertiary Canonical Source(s) (sde dge bka' 'gyur),Scene working notes
1,1,1,དེ་ལས་དང་པོ་དགའ་ལྡན་དུ་ལྷའི་བུ་དམ་པ་ཏོག་དཀར་པོར་གྱུར་པའི་ཚུལ་ནི།,"Chapter 1. How the Bodhisattva Becomes the Divine Son Shvetaketu in Tushita",དགའ་ལྡན་,Tushita,,,,,
1,1,1,དེ་ཡང་སྔོན་སྐྱེ་དགུ་རྣམས་ཀྱི་ཚེ་ལོ་ཉི་ཁྲི་ཐུབ་པའི་དུས་ན།  བཅོམ་ལྡན་འདས་འོད་སྲུངས་འཇིག་རྟེན་དུ་བྱོན།,"Eons upon eons ago, when human life could last up to twenty thousand years, the Blessed One Kashyapa appeared in the world. ",,,,,"Vinayavastu: Kha, 150a.5-6","Lhasa Kangyur dkar chag (H 809: vol. 100, folio/line 58b.4-5)","dkar chag: ""skye dgu'i tshe lo nyi khri'i dus rgyal po kri kris wa ra Na sir sa gzhi skyong ba'i tshe rdzogs pa'i sangs rgyas 'od srung 'jig rten du byon/"""
1,1,1,དེའི་དུས་ན་འོ་སྐོལ་གྱི་སྟོན་པ་འདི་བྲམ་ཟེའི་ཁྱེའུ་བླ་མ་ཞེས་བྱ་བར་གྱུར། ,Our teacher was a brahmin youth named Uttara then.,,,,,,"",
1,1,1,དེ་ནས་འཕོས་ཏེ་དགའ་ལྡན་གྱི་ལྷ་རྣམས་ཀྱི་སྟོན་པ་བྱང་ཆུབ་སེམས་དཔའ་དམ་པ་ཏོག་དཀར་པོ་ཞེས་བྱ་བར་གྱུར་ཏེ།,"Then he was reborn, and became the bodhisattva Shvetaketu, the teacher of the gods in Tushita.",,,,,,"Lhasa Kangyur dkar chag (H 809: vol. 100, folio/line 109a.3-4)","See passage in the Lhasa bka' 'gyur dkar chag: ""bram ze khye'u bla ma nas tshe 'phos te dga' ldan gyi lha'i bu dam pa tog dkar zhes bya ba skye ba gcig thogs kyi byang chub sems dpa'i tshul bzung nas rtsod ldan tshe lo brgya par thug gi bar dga' ldan gyi lha'i gzhal med khang yon tan dang rgyan gyi bkod pa phun sum tshogs pa dang ldan par lha rnams la chos ston cing bzhugs pa'i tshe [...]"" (H 809: vol. 100, folio/line 109a.3-109a.4)"
1,1,1,སྐྱེ་བ་གཅིག་གིས་ཐོགས་པའི་བྱང་ཆུབ་སེམས་དཔའི་ཚུལ་བཟུང་ནས།  དགའ་ལྡན་ན་གནས་པ་རྣམས་གཙོ་ཆེར་གྱུར་པའི་ལྷ་ལ་སོགས་པའི་འགྲོ་བ་རྣམས་རབ་ཏུ་སྨིན་པའི་ཕྱིར།  ཡང་དག་པའི་ཆོས་སྟོན་པར་མཛད་དོ།,"He followed the ways of bodhisattvas in their final life, and taught the authentic Dharma to the principal gods and the other inhabitants of Tushita to lead them to spiritual maturity.",བྱང་ཆུབ་སེམས་དཔའ། ལྷ་ལ། ཆོས་བསྟན་པ་,The Bodhisattva teaches dharma to the gods,,,,"Lhasa Kangyur dkar chag (H 809: vol. 100, folio/line 109a.3-4)",See passage above
1,1,1,།དེ་ནས་བརྩམས་ཏེ་འཛམ་བུ་གླིང་པ་རྣམས་ཚེ་ལོ་བརྒྱ་པ་ལ་གནས་པའི་བར་དུ་དགའ་ལྡན་གྱི་གནས་དེ་ཉིད་དུ་སྐུ་ལུས་ཀྱི་རྟེན་དེ་ཁོ་ནས་བཞུགས་སོ།།,"From then until the era in which humans lived only one hundred years, Shvetaketu occupied that same body in the Tushita realm.",,,,,,"Lhasa Kangyur dkar chag (H 809: vol. 100, folio/line 109a.3-4)",See passage above
