Mural Panel,Chapter,Mural Scene,Sun of Faith - Tibetan (བོད་ཡིག།),Sun of Faith - English,Inscription - Tibetan (བོད་ཡིག།) ,Inscription - English,Manual - Tibetan (བོད་ཡིག།),Manual - English,Main Canonical Source (sde dge bka' 'gyur),Secondary/Tertiary Canonical Source(s) (sde dge bka' 'gyur),Scene working notes,"<svg xmlns='http://www.w3.org/2000/svg'><path xmlns='http://www.w3.org/2000/svg' d='M20792.7,6953.3c62,48.7,393.3,180,415.3,166.7c22-13.3,142-155.3,164.7-191.3c53.3-84.7,146.7-155.3,213.3-218c66.7-62,93.3-186.7,106.7-253.3s40-373.3,18-488.7c-22-115.3-266.7-258-302-293.3c-35.3-35.3-133.3-115.3-173.3-160c-40-44.7-18-182-22-204.7c-4.7-22-88.7-62-106.7-40c-18,22-35.3,111.3-40,164.7s-142,111.3-200,142c-50.7,27.3-335.3,160-335.3,160c-114,65.3-228,121.3-218.7,181.3c-58.7-73.3-88.7-110.7-161.3-141.3c-84.7-35.3-174-66.7-395.3-84.7c-218-18-811.3-40-898-40c-82,0-177.3-13.3-174.7-13.3c0,0,20-206.7,10-220s-926.7-1196.7-943.3-1196.7s-130-10-253.3-13.3s-596.7-20-666.7-26.7s-13.3-33.3-3.3-80s-10-66.7-53.3-110s-80-30-96.7-83.3s10-26.7-3.3-80s-36.7-50-83.3-76.7s-53.3-40-53.3-66.7s40-90,43.3-120s-10-56.7-23.3-100s-40-66.7-60-90s-40-16.7-70-26.7s-63.3,10-100,26.7s-66.7,46.7-86.7,76.7s-10,76.7-20,110s-53.3,6.7-46.7-30s-23.3-66.7-53.3-96.7s-40-33.3-73.3-53.3s-10-70-10-106.7s-86.7-106.7-126.7-140s-20-53.3-43.3-76.7s-23.3-50-46.7-80s-75.3-6.7-75.3-6.7c35.3-31.3,62-48.7,84.7-102c22-53.3,13.3-120-13.3-133.3s-35.3-35.3-48.7-80c-13.3-44.7,6.7-91.3,35.3-115.3c30.7-26,102-53.3,151.3-84.7c48.7-31.3,53.3-66.7,98-168.7c44.7-102,44.7-126.7,44.7-166.7c0-66.7-26.7-75.3-75.3-106.7c-48.7-31.3-115.3-38-151.3-53.3c-35.3-15.3,0-20-13.3-46.7s-20-53.3-55.3-58c-35.3-4.7-38-22-42-44.7c-4.7-22-93.3-40-88.7-62c4.7-22-44.7-66.7-80-75.3c-35.3-8.7-40-35.3-58-53.3c-18-18-115.3-26.7-115.3-53.3s-80-40-84.7-58c-4.7-18-62-40-93.3-40c-31.3,0-22-58-58-98s-44.7-13.3-53.3-35.3c-8.7-22-115.3-48.7-168.7-53.3c-53.3-4.7-124.7-4.7-186.7,26.7c-62,31.3-40,35.3-93.3,58c-53.3,22-40,66.7-44.7,84.7s-4.7,31.3-53.3,35.3c-48.7,4.7-48.7,13.3-84.7,53.3c-35.3,40-35.3,120-48.7,142c-13.3,22-26.7,31.3-31.3,66.7c-4.7,35.3-31.3,58-62,102s106.7,142,84.7,168.7c-22,26.7-62,48.7-93.3,62c-31.3,13.3-49.3,62-49.3,62.7c-12-23.3-20.7-62.7-35.3-84.7c-18-26.7-44.7-31.3-48.7-53.3c-4.7-22-71.3-26.7-128.7-44.7c-58-18-44.7-48.7-53.3-75.3c-8.7-26.7-48.7-40-93.3-66.7c-44.7-26.7-40-31.3-40-62s-44.7-44.7-84.7-66.7s-71.3-26.7-71.3-53.3s-22-66.7-44.7-98c-22-31.3-106.7-44.7-168.7-58s-62-58-75.3-71.3s-80-53.3-133.3-66.7s-44.7-40-80-75.3c-35.3-35.3-98-62-195.3-98c-98-35.3-182,18-231.3,44.7c-48.7,26.7-62,66.7-98,102s-8.7,66.7-40,93.3s-26.7,58-66.7,66.7s-40,71.3-71.3,98c-31.3,26.7-182,35.3-258,44.7c-75.3,8.7-293.3,0-382-13.3s-284.7-93.3-320-98c-35.3-4.7-155.3-44.7-182-71.3s-80-66.7-178-98c-98-31.3-271.3,58-338,102c-66.7,44.7-244.7,53.3-351.3,58c-106.7,4.7-368.7,48.7-413.3,84.7c-44.7,35.3-244.7,31.3-458,75.3c-213.3,44.7,124.7,124.7,213.3,128.7c88.7,4.7,133.3,71.3,231.3,80c98,8.7,31.3,93.3-4.7,138c-35.3,44.7,173.3,93.3,244.7,115.3c71.3,22,200,98,218,98c18,0,48.7,35.3,31.3,53.3c-18,18-102,84.7-133.3,102c-31.3,18-62,40-98,62c-35.3,22-58,18-98,31.3s-35.3,22-80,35.3c-44.7,13.3-88.7,80-102,115.3c-13.3,35.3-35.3,18-71.3,48.7c-35.3,31.3-48.7,62-71.3,98c-22,35.3,32,59.3-8.7,80c-88.7,44.7-88.7,133.3-98,155.3c-8.7,21.3-118.7,54.7-62,84.7c5.3,17.3,106.7,30.7,155.3,44c48.7,13.3,80,62,102,71.3c22,8.7,164.7,98,168.7,115.3c4.7,18,40,84.7,80,93.3s48.7,58,62,75.3c13.3,18,80,80,93.3,88.7c13.3,8.7,59.3,54,80,62c58,22,142,111.3,160,115.3c18,4.7,94,4,128.7,15.3c53.3,18,40,51.3,80,55.3s70,15.3,98,18c48.7,4.7,71.3,40,106.7,40s88.7,4.7,111.3,4.7c22,0,71.3,48.7,111.3,48.7s75.3,40,115.3,35.3s186.7-62,204.7-120c18-58,204.7-26.7,284.7-26.7s191.3-71.3,195.3-120c4.7-48.7,80-155.3,115.3-186.7c35.3-31.3,186.7,8.7,253.3,13.3s160-18,204.7-31.3c44.7-13.3,191.3-48.7,222-58c31.3-8.7,213.3-18,266.7-31.3s204.7-4.7,258-13.3s458-44.7,506.7-84.7c42.7-34.7,8-102.7-30.7-154.7c14,8,48,24.7,74.7,26c18,0.7,112,44.7,156,80c44.7,35.3,84.7,58,168.7,48.7c84.7-8.7,133.3-133.3,155.3-178c20.7-42,116-75.3,186.7-90.7c-5.3,2-11.3,6.7-20,17.3l-2,2c-15.3,17.3-46.7,63.3-66.7,73.3s-50,33.3-43.3,53.3s70,76.7,40,93.3s-93.3,30-120,43.3s-66.7,30-90,46.7s-43.3,33.3-66.7,53.3s-53.3,43.3-33.3,63.3s63.3,120,80,146.7s33.3,43.3,50,66.7s43.3,40,66.7,53.3s90,56.7,90,96.7s-20,83.3-50,116.7s-160,96.7-176.7,120s-233.3,106.7-223.3,116.7s66.7,53.3,73.3,70s33.3,86.7,30,106.7s-10,43.3,20,66.7c2,2,24,11.3,26.7,13.3l3.3,3.3c-30-40,20-120,50-146.7s30-90,63.3-143.3s103.3-66.7,150-70s103.3,13.3,113.3,30s30,100,16.7,123.3s-36.7,63.3-6.7,76.7s73.3,46.7,86.7,76.7s10,86.7,3.3,103.3s-56.7,16.7-20,56.7s54.7,106.7,66.7,120c20,23.3,40.7,65.3,80,76.7c46.7,13.3,126.7,3.3,150-43.3s30-116.7,70-150s130-36.7,153.3-16.7s60,66.7,46.7,110c-7.3,24.7-36.7,16.7-20,63.3s30,53.3,16.7,83.3s-26.7,36.7,6.7,66.7s50,73.3,20,103.3s-56.7,60-13.3,73.3s120,53.3,133.3,96.7s20,80,23.3,96.7s26.7,213.3,10,260c0,0,30-46.7,716.7-6.7c326.7,19.3,719.3,33.3,1003.3,60c104.7,10,201.3,19.3,300.7,28c7.3,12.7,39.3,66.7,47.3,86c8.7,22,71.3,200,75.3,235.3s13.3,88.7-51.3,128.7c-31.3,0-53.3,40-53.3,40c-8.7,26.7-75.3,44.7-75.3,44.7c-33.3,3.3-216.7-26.7-266.7-30s-136.7-10-180-16.7c-29.3-4.7-100-33.3-106.7-53.3s-23.3-110-36.7-90s-20,56.7-20,80s20,76.7-43.3,90s-66.7-13.3-86.7-33.3c-20-20,43.3-133.3-26.7-200c-38.7-36.7-113.3-10-143.3-6.7s-40-13.3-76.7-16.7c-14-1.3-68.7,16-130,76.7c-22.7,22.7-37.3-32.7-120-20c-86.7,13.3-73.3,63.3-100,106.7c-36,58.7-16,164-20,163.3c-50-10-56.7,16.7-83.3,73.3c-22,46.7-65.3,96-73.3,123.3c-10,34.7-40,64-64.7,78l-4.7,0c0,0,8.7,48.7,22,71.3c13.3,22,53.3,18,84.7,26.7c31.3,8.7,44.7,88.7,58,88.7s40,26.7,58,40s31.3,88.7,31.3,88.7s18,22,31.3,35.3s13.3,84.7,13.3,84.7s13.3,31.3,13.3,80s-35.3,66.7-66.7,71.3c-31.3,4.7,0,40,31.3,111.3c31.3,71.3,213.3,200,213.3,200s62,53.3,124.7,128.7c62,75.3,151.3,244.7,173.3,288.7c22,44.7,106.7,311.3,106.7,311.3c0,13.3,0,35.3,0,58c0,35.3,226.7,186.7,262,222s320,240,338,240c0,0,288.7,22,368.7,22s88.7,8.7,106.7,53.3c18,44.7,0,173.3,0,173.3s302,93.3,328.7,102c26.7,8.7,364.7-146.7,448.7-168.7c84.7-22,514.7-180.7,618-204.7c155.3-35.3,378-26.7,453.3-31.3c75.3-4.7,58.7-22.7,88.7-48.7c35.3-31.3,40-35.3,66.7-58s62-18,88.7-40s60-46.7,75.3-62c35.3-35.3,88.7-75.3,133.3-111.3c44.7-35.3,35.3-84.7,53.3-128.7c18-44.7-35.3-124.7-58-155.3c-22-31.3-4.7-84.7,0-164.7c4.7-80,13.3-58-22-102c-22.7-28-26.7-40-22-71.3c1.3-10,2.7-20,2.7-30c8.7,14,124.7,52,172.7,34.7c48.7-18,288.7-164.7,342-200c53.3-35.3,186.7-128.7,218-191.3c31.3-62,58-226.7,26.7-266.7L20792.7,6953.3z' data-paper-data='{&quot;rotation&quot;:0,&quot;annotation&quot;:null}' id='smooth_path_e0c94e07-0993-440f-bbd1-8154642129a8' fill-opacity='0' fill='#f1d0a9' stroke='#f1d0a9' stroke-width='23.50433' stroke-linecap='butt' stroke-linejoin='miter' stroke-miterlimit='10' stroke-dasharray='' stroke-dashoffset='0' font-family='sans-serif' font-weight='normal' font-size='12' text-anchor='start' mix-blend-mode='normal'/></svg>"
A,10,,བཅུ་པ་སྒྱུ་རྩལ་གྱི་སྟོབས་བསྟན་པ་ནི།,Chapter 10 The Bodhisattva reveals his ability in the martial arts,,,Vol. Kha (2) pp. 13-14.,,"Vinayavastu (Saṃghabhedavastu): vol. 3 (Ga), 288a.4-289b.4",Abhiniṣkramaṇa-sūtra: vol. 72(Sa),
A,10,,དེ་ནས་དུས་གཞན་ཞིག་ན།  ཤཱཀྱ་གཤོན་ནུ་ལྔ་བརྒྱ་ཕྱིར་བྱུང་བ་ན།,"One day when the five hundred Shakya youths were playing outside,",,,ལྷས་སྦྱིན་གྱི་གླང་པོ་ཆེ་བསད་པ་དང་། དགའ་བོས་འཇུག་མ་ནས་བོར་བ་དང་། བྱང་ཆུབ་སེམས་དཔས་ཕྱག་གི་རིང་དུ་འཕང་པ་རྣམས་སྤྱི་དང་འདྲ། འདི་ལ་ཞབས་ཀྱི་མཐེ་པོས་འཕང་པ་ཐེག་ཆེན་གྱི་ལུགས་ཡིན། སྔོན་འབྱུང་ལུགས་དང་། འདུལ་བ་སོགས་ནས་ཕྱག་གི་འཕང་པ་གསལ་བར་བཤད། ཤིང་མང་པོ་རལ་གྲིས་བཅད་པ། གཞན་རྣམས་ཀྱིས་བཅད་པ་ཚོ་བཅད་མ་ཐག་འགྱེལ། བྱང་ཆུབ་སེམས་དཔས་དེ་བཅད་ཀྱང་རིང་དུ་མ་འགྱེལ་བ་དང་། རླུང་པོ་བྱུང་ནས་འགྱེལ་བ་འབྲི།   དེ་ནས་མདའ་ཚ་བས་འདྲེན་པའི་བཀོད་པ་སྤྱི་དང་འདྲ། སྤྱིར་སྒྱུ་རྩལ་ལྔ་བརྒྱའི་བར་དུ་འགྲན་པ་ཡིན་ཀྱང་། སྔོན་འབྱུང་དང་འདུལ་བ་ལས་ལོ་རྒྱུས་ལྷག་མ་གསུངས་པ་མེད་པས་སྐབས་འདིར་དེ་ཙམ་གྱིས་ཆོག  །སྒྱུ་རྩལ་མཁས་པར་བསྟན་པའི་སྐོར་རོ། །,"Devadatta (lhas sbyin) kills an elephant. Nanda (dga’ bo) catches an elephant by the tail, but loses it.  The Buddha grabs an elephant and throws it far away. This scene should accord with common [understandings]. The Mahayana tradition has it that the Buddha throws an elephant with his big toe, but it is clear in the traditions of History (sngon 'byung) and Vinaya and so forth that Buddha throws an elephant with his hand. Many trees are cut. The trees fall immediately when others cut them down. The trees the Buddha cuts down won't fall for a long time. They only fall when winds blow them. Then, there is the archery contests drawn according to common conceptions. Generally, the Buddha competes in up to five hundred categories of sports, but the traditions of History (sngon 'byung) and Vinaya are silent on the rest of the sport categories, so it is fine for us to leave off here.",N/A,"Abhiniṣkramaṇa-sūtra: vol. 72(Sa), 18b.3",
A,10,,ཤཱཀྱ་གཤོན་ནུ་གཞན་རྣམས་ལྷས་བྱིན་གྱིས་སྟོབས་འགྱེད་པས་བསྒྱེལ་བ་ན།,Devadatta started challenging everyone. He fought one boy after another and knocked each one down.,,,,,N/A,"Abhiniṣkramaṇa-sūtra: vol. 72(Sa), 18b.3",
A,10,,བྱང་ཆུབ་སེམས་དཔའ་ཕྱོགས་དེར་བྱོན་ནས།,"Seeing the Bodhisattva approach the area,",,,,,N/A,"Abhiniṣkramaṇa-sūtra: vol. 72(Sa), 18b.3",
A,10,,ལྷས་བྱིན་ཕྱག་གིས་བསྣམས་ཏེ།,Devadatta lunged towards him so as to strike him.,,,,,N/A,"Abhiniṣkramaṇa-sūtra: vol. 72(Sa), 18b.4",
A,10,,གནོད་པ་མེད་པར་རྒྱང་རིང་དུ་འཕངས་པས།,"but was abruptly propelled high up into the air, and, without any injury,",,,,,N/A,N/A,
A,10,,རྐང་པ་གྱེན་དུ་བསྟན་ནས་གན་རྐྱལ་དུ་ལྟུང་ངོ་།,"fell back hard onto the ground, landing on his back with his feet skyward.",,,,,N/A,"Abhiniṣkramaṇa-sūtra: vol. 72(Sa), 18b.4",
A,10,,།ཞེས་པ་འདི་མངོན་པར་འབྱུང་བའི་མདོ་ལས་བཤད་དོ།,These facts are described in the Abhiniṣkramaṇa-sūtra.,,,,,,,
A,10,,།དེ་ནས་ཡངས་པ་ཅན་པའི་ལི་ཙ་བི་རྣམས་ཀྱིས་གླང་པོ་ཆེ་མཚན་ལྡན་ཞིག་རྙེད་ནས།,"Shortly thereafter, the Licchavis of the city of Vaishali (Yangs pa can/ Bai sha la) captured an elephant that bore some extremely unusual marks.",,,,,288a.4,,
A,10,,ཟས་གཙང་གི་སྲས་འཁོར་ལོས་སྒྱུར་བར་འགྱུར་གྱི།  དེའི་མཐུ་ལས་གླང་པོ་ཆེ་རིན་པོ་ཆེ་འདི་བྱུང་བས་,"Reckoning that a creature so remarkable looking must owe its existence to the power of Shuddhodana's son (whom all saw as destined to become a universal monarch),",,,,,288a.4,,
A,10,,དེ་ཁོ་ན་ལ་འབུལ་ལོ་ཞེས་ཕོ་ཉ་མངགས་ཏེ།,the Licchavis decided to offer the elephant to him.,,,,,288a.4-5,,
A,10,,སེར་སྐྱའི་གཞིར་ཕྱིན་ནས་ཕོ་བྲང་གི་སྒོ་གླང་པོ་ཆེ་དེ་ཁྲིད་ནས་བསྡད་པ་ན།,"They therefore sent off an elephant driver to deliver the present up to Siddhartha. On reaching Kapilavastu, the mahout drove the elephant to the palace gates and waited for the prince to show up.",,,,,288a.5,,
A,10,,ལྷས་བྱིན་ཕྱིར་བྱུང་བས་,"Instead, Devadatta arrived on the scene,",,,,,288a.5-6,,
A,10,,མཐོང་སྟེ་གླང་པོ་དམ་པ་འདི་ཅི་ཞེས་དྲིས་པ་ན།,and noticing the magnificent animal interrogated the Licchavis' messenger—,,,,,288a.6,,
A,10,,དེ་དག་གིས་སྔར་བཞིན་བསྙད་པས་,who blurted out the whole story. ,,,,,288a.6-7,,
A,10,,ལྷས་བྱིན་ཕྲག་དོག་སྐྱེས་ཏེ།  དེ་འཁོར་ལོས་སྒྱུར་བར་མ་སོང་བའི་སྔོན་རོལ་ནས་གླང་ཆེན་འབུལ་ལམ་ཞེས་,"“What an idiotic idea, giving this elephant to the prince even before he has attained the rank of a universal monarch!” Devadatta fumed, mad with jealousy.",,,,,288a.7-288b.1,,
A,10,,ཐལ་ལྕག་བསྣུན་ནས་གླང་པོ་ཆེ་བསད་དོ།,He slapped the beast with the palm of his hand and killed him.,,,,,288b.1,,
A,10,,།དགའ་བོས་དེ་མཐོང་ནས།  ལྷས་བྱིན་གྱིས་ནི་རང་གི་མཐུ་བསྟན་གྱི།  བདག་གིས་ཀྱང་བསྟན་ནོ་སྙམ་ནས་,"On sighting the massive corpse, Nanda (Dga' bo), the Bodhisattva's half-brother, said to himself: “Well, since Devadatta has let his strength be displayed in broad daylight, I needn't conceal my own.”",,,,,288b.1-2,,
A,10,,དེའི་མཇུག་མ་ནས་བཟུང་སྟེ་ཁྱེར་ནས་གོམ་པ་བདུན་ཙམ་སོང་ནས་མཐའ་ཅིག་ཏུ་བོར་རོ།,"Nanda caught hold of the elephant by its tail, dragged it a few paces and flung it by the wayside.",,,,,288b.2,,
A,10,,།དེ་ནས་བྱང་ཆུབ་སེམས་དཔའ་བྱོན་ཏེ། དེ་གཟིགས་ནས་དྲི་བ་མཛད་པ་ན་,"At that point the Bodhisattva appeared near the city gates, wishing to know what had occurred.",,,,,288b.2-4,,
A,10,,སྔར་བཞིན་རྒྱས་པར་བསྙད་དོ། །འོ་ན་བདག་གིས་ཀྱང་མཐུ་སད་པར་བྱའོ་སྙམ་དུ་དགོངས་ནས་,"Once he learned the circumstances, he also said to himself: “If that's the case, then I needn't hold back.”",,,,,288b.4,,
A,10,,འི་མཇུག་མ་ནས་ཕྱག་གིས་བཟུང་སྟེ་བཏེག་ནས་རྒྱང་དུ་འཕངས་པས།,"With one finger he took hold of the elephant's tail, lifted the beast off the ground and hurled it.",,,,,288b.4,,
A,10,,ལྕགས་རི་རིམ་པ་བདུན་དང་འོབས་རིམ་པ་བདུན་འདས་ཏེ་རྒྱང་གྲགས་ཙམ་གྱི་ཕ་རོལ་ཏུ་ལྷུངས་ཤིང་།,"The carcass flew above the seven ramparts, above the seven moats that encircled the city and fell at some hundreds of fathoms,",,,,,288b.4-5,,
A,10,,ཕྱོགས་དེར་ས་ལ་གཤོང་བུ་དོད་པས་,thus making a wide depression in the ground.,,,,,"288b.5",,
A,10,,གླང་བོའི་གཤོང་ཞེས་གྲགས་ཤིང་དེར་མཆོད་རྟེན་ཡང་བྱས་སོ།,"This famous valley, called Elephant Hollow, was commemorated by the construction of a stupa.",,,,,288b.5-6,,
A,10,,།དེ་ནས་གཞོན་ནུ་རྣམས་ནགས་སུ་ཕྱིན་ཏེ་,The five hundred stalwart youths then went off to the forest [to compete with each other in the martial arts]. ,,,,,"288b.7",,
A,10,,་རལ་གྲིས་ཤིང་གཅོད་པའི་སྒྱུ་རྩལ་སྟོན་པ་ན།  བྱང་ཆུབ་སེམས་དཔའ་ཡང་དེར་བྱོན་ཏེ།,They were occupied in chopping down trees with their sabers when the Bodhisattva joined them.,,,,,288b.7,,
A,10,,གཞན་རྣམས་ཀྱིས་ཤིང་བཅད་པ་ན་བཅད་ཁ་མཐོ་དམན་ཅན་དུ་གྱུར་པས་བཅད་ཙམ་ཉིད་ནས་འགྱེལ།,"The other boys were hacking at the trunk, one cut to the left, one to the right, and the tree came down.",,,,,288b.7-289a.1,,
A,10,,བྱང་ཆུབ་སེམས་དཔའི་རྣམས་མཐོ་དམན་མེད་ཅིང་,But the Bodhisattva did not slash at the trunk from the sides.,,,,,289a.1,,
A,10,,་ཡོ་འཁྱོག་མེད་པར་བཅད་པས་མ་འགྱེལ་བར་སྔར་བཞིན་འདུག་གོ,He cleft it with one horizontal stroke of his sword. This left the tree standing as if nothing had happened to it.,,,,,289a.1,,
A,10,,བྱང་ཆུབ་སེམས་དཔས་གཅོད་མ་ཐུབ་བོ་སྙམ་གཅོད་པའི་རིག་པ་མི་མཁྱེན་ནོ་ཞེས་སྨོད་ཅིང་,"Watching him in action, the other Shakyas thought that since he had not received his training alongside them, he did not know how to fell trees.",,,,,289a.1-2,,
A,10,,གླེང་བར་བརྩམས་པ་ན།  རླུང་སེར་བུ་ཞིག་ལངས་ནས་,They were smirking and whispering among themselves until a light breeze rose.,,,,,"289a.2-4",,
A,10,,བྱང་ཆུབ་སེམས་དཔས་བཅད་པའི་ཤིང་དེ་དག་དུས་གཅིག་ཏུ་ཆོམ་ཞེས་འགྱེལ་པས་ཐམས་ཅད་ངོ་མཚར་དུ་གྱུར་ཏོ།,Picture their bewilderment when they saw that the trees slashed at by the Bodhisattva all came down with one accord and with an earsplitting crack.,,,,,289a.4,,
A,10,,།དེ་ནས་ཤཱཀྱ་གཞོན་ནུ་རྣམས་མདའ་ཚབས་འགྲན་པ་ལ་ཞུགས་ཏེ།,"Next, the young people chose to hold an archery competition.",,,,,289a.4-5,,
A,10,,ལྕགས་ཀྱི་ཏ་ལ་བདུན་དང་།  ལྕགས་རྔ་བདུན་དང་།  ལྕགས་ཀྱི་ཕག་གཟུགས་གཅིག་རྣམས་འབེན་དུ་བཙུགས་ཏེ་,". They set up several targets—seven palm trees, seven drums and a boar, all made of metal—",,,,,289a.5,,
A,10,,སོ་སོར་མདའ་འཕངས་བ་ལས།,and took aim one after another.,,,,,289a.5,,
A,10,,ལྷས་བྱིན་གྱིས་ཏ་ལ་གཅིག་ཕིགས།,Devadatta's arrow went right through one metal target ,,,,,289a.5,,
A,10,,དགའ་བོས་གཉིས་ཕུག་སྟེ།,"and that of Nanda, through two.",,,,,289a.5,,
A,10,,གཞན་སུས་ཀྱང་དེ་ལས་ལྷག་པ་མ་ཕུག་གོ,Nobody could better that.,,,,,N/A,,
A,10,,།བྱང་ཆུབ་སེམས་དཔས་ལྕགས་མདའ་འཕངས་པ་དང་། འབེན་དེ་ཐམས་ཅད་ཕུག་ནས་,"Taking a bronze arrow, the Bodhisattva pierced all the targets in a single strike.",,,,,289a.5-6,,
A,10,,སླར་ཡང་རྒྱང་རིང་པོར་སོང་ཞིང་,"The arrow continued to fly far, very far",,,,,N/A,,
A,10,,མདའ་དེས་ས་ལ་ཕུག་སྟེ།,before getting embedded deep in the ground.,,,,,289a.6,,
A,10,,མདས་ཕུག་པའི་བུ་ག་ནས་ཀླུ་རྣམས་ཀྱིས་རོ་ཕུན་སུམ་ཚོགས་པ་དང་ལྡན་པའི་ཆུ་ཕྱུང་བས་,From this hole serpent-spirits made water of a thousand flavors come gushing out.,,,,,289a.6,,
A,10,,དེ་ལ་མདའ་ཆུ་ཁྲོན་པ་ཞེས་གྲགས་ཤིང་,"Later this site known as Arrowborn Well,",,,,,N/A,Could not find a canonical source that mentions this name,
A,10,,དེར་ཡང་མཆོད་རྟེན་བྱས་སོ།,And was commemorated by a stupa.,,,,,289a.7,,
A,10,,།དེ་ནས་མཚན་མཁན་རྣམས་ཀྱིས་གཞོན་ནུ་དོན་ཐམས་ཅད་གྲུབ་པ་ད་སྟེ་ལོ་བཅུ་གཉིས་སུ་རབ་ཏུ་མ་བྱུང་ན།  གདོན་མི་ཟ་བར་འཁོར་ལོས་སྒྱུར་བའི་རྒྱལ་པོར་འགྱུར་རོ།  །ཞེས་ལུང་སྟོན་ཏོ། །,"Oracle-priests predicted that were Prince Siddhartha to refrain from renouncing the worldly life over the next twelve years to come, he would definitely become a universal monarch.",,,,,289a.7-289b.4,,
A,10,svg1,,,,,,,,,,"<svg xmlns='http://www.w3.org/2000/svg'><path xmlns='http://www.w3.org/2000/svg' d='M16299.3,7355.3c0,0-182-128.7-213.3-200c-31.3-71.3-62-106.7-31.3-111.3c31.3-4.7,66.7-22,66.7-71.3s-13.3-80-13.3-80s0-71.3-13.3-84.7s-31.3-35.3-31.3-35.3s-13.3-75.3-31.3-88.7s-44.7-40-58-40s-26.7-80-58-88.7c-31.3-8.7-71.3-4.7-84.7-26.7c-13.3-22-22-71.3-22-71.3l4.7,0c24.7-14,54.7-43.3,64.7-78c8-27.3,51.3-76.7,73.3-123.3c26.7-56.7,33.3-83.3,83.3-73.3c4,0.7-16-104.7,20-163.3c26.7-43.3,13.3-93.3,100-106.7c82.7-12.7,97.3,42.7,120,20c61.3-60.7,116-78,130-76.7c36.7,3.3,46.7,20,76.7,16.7s104.7-30,143.3,6.7c70,66.7,6.7,180,26.7,200c20,20,23.3,46.7,86.7,33.3s43.3-66.7,43.3-90s6.7-60,20-80s30,70,36.7,90s77.3,48.7,106.7,53.3c43.3,6.7,130,13.3,180,16.7s233.3,33.3,266.7,30c0,0,66.7-18,75.3-44.7c0,0,22-40,53.3-40c31.3,0,66.7-13.3,98-8.7s58,35.3,98,35.3s58-62,98-44.7c40,18,22,71.3,58,115.3s53.3,142,31.3,195.3c-22,53.3-75.3,160-22,218s138,173.3,138,235.3s44.7,146.7,44.7,208.7c0,62-4.7,133.3-40,208.7c-30.7,64.7-128.7,133.3-106.7,275.3c22,142,66.7,258,66.7,298s22,120,4.7,146.7c-18,26.7-111.3,31.3-195.3,31.3c-54,0-204.7-22-311.3-22s-182,18-244.7,18c-62,0-138-8.7-248.7-4.7c-58,2-115.3-18-191.3-8.7c-35.3,4-84.7,22-84.7,22l-8.7,115.3c0,0-84.7-266.7-106.7-311.3c-22-44.7-111.3-213.3-173.3-288.7C16361.3,7408.7,16299.3,7355.3,16299.3,7355.3z' data-paper-data='{&quot;rotation&quot;:0,&quot;annotation&quot;:null}' id='smooth_path_e0c94e07-0993-440f-bbd1-8154642129a8' fill-opacity='0' fill='#f1d0a9' stroke='#f1d0a9' stroke-width='23.50433' stroke-linecap='butt' stroke-linejoin='miter' stroke-miterlimit='10' stroke-dasharray='' stroke-dashoffset='0' font-family='sans-serif' font-weight='normal' font-size='12' text-anchor='start' mix-blend-mode='normal'/></svg>"
